Create table employee(ssn integer primary key, name varchar2(20), deptno integer)

##Create table assigned_to(USN integer primary key, projectno integer primary key)

##Create table project(projectno integer references assigned_to, projectarea varchar2(20))


insert into employee values(1,'vybhav',1)

insert into employee values(2,'vishal',2)

insert into employee values(3,'anirudh',3)

insert into employee values(4,'karthikeyan',4)

insert into employee values(5,'vijay',5)

select * from employee

       SSN NAME 		    DEPTNO
---------- -------------------- ----------
	 1 vybhav			 1
	 5 vijay			 5
	 2 vishal			 2
	 3 anirudh			 3
	 4 karthikeyan			 4

select SSN,name from employee
  2  ;

       SSN NAME
---------- --------------------
	 1 vybhav
	 5 vijay
	 2 vishal
	 3 anirudh
	 4 karthikeyan

// select NAME from employee where DEPTNO =3  ## select from where clause

select NAME,SSN from employee where DEPTNO =3
  2  ;

NAME			    SSN
-------------------- ----------
anirudh 		      3


select NAME,SSN from employee where DEPTNO =2 or DEPTNO = 3; 

NAME			    SSN
-------------------- ----------
vishal			      2
anirudh 		      3
abc			      6
xyz			      7


alter table employee add departmentname varchar2(20);

Table altered.

SQL> select * from employee
  2  ;

       SSN NAME 		    DEPTNO DEPARTMENTNAME
---------- -------------------- ---------- --------------------
	 1 vybhav			 1
	 5 vijay			 5
	 2 vishal			 2
	 3 anirudh			 3
	 4 karthikeyan			 4
	 6 abc				 3
	 7 xyz				 2

7 rows selected.

desc employee
 Name					   Null?    Type
 ----------------------------------------- -------- ----------------------------
 SSN					   NOT NULL NUMBER(38)
 NAME						    VARCHAR2(20)
 DEPTNO 					    NUMBER(38)
 DEPARTMENTNAME 				    VARCHAR2(20)

update employee set departmentname='maths' where ssn=2
  2  ;

1 row updated.

SQL> select * from employee
  2  
SQL> select * from employee
  2  ;

       SSN NAME 		    DEPTNO DEPARTMENTNAME
---------- -------------------- ---------- --------------------
	 1 vybhav			 1
	 5 vijay			 5
	 2 vishal			 2 maths
	 3 anirudh			 3
	 4 karthikeyan			 4
	 6 abc				 3
	 7 xyz				 2

7 rows selected.

delete from employee where ssn=2;

1 row deleted.

SQL> select * from employee
  2  ;

       SSN NAME 		    DEPTNO DEPARTMENTNAME
---------- -------------------- ---------- --------------------
	 1 vybhav			 1
	 5 vijay			 5
	 3 anirudh			 3
	 4 karthikeyan			 4
	 6 abc				 3
	 7 xyz				 2

6 rows selected.

SQL> alter table employee add trial varchar2(20);

Table altered.

SQL> select * from employee
  2  ;

       SSN NAME 		    DEPTNO DEPARTMENTNAME
---------- -------------------- ---------- --------------------
TRIAL
--------------------
	 1 vybhav			 1


	 5 vijay			 5


	 3 anirudh			 3



       SSN NAME 		    DEPTNO DEPARTMENTNAME
---------- -------------------- ---------- --------------------
TRIAL
--------------------
	 4 karthikeyan			 4


	 6 abc				 3


	 7 xyz				 2



6 rows selected.

SQL> alter table employee drop column trial
  2  ;

Table altered.

SQL> select * from employee
  2  ;

       SSN NAME 		    DEPTNO DEPARTMENTNAME
---------- -------------------- ---------- --------------------
	 1 vybhav			 1
	 5 vijay			 5
	 3 anirudh			 3
	 4 karthikeyan			 4
	 6 abc				 3
	 7 xyz				 2

6 rows selected.

commit
  2  ;

Commit complete.

SQL> update employee set ssn=11 where ssn=5
  2  ;

1 row updated.

SQL> select * from employee
  2  ;

       SSN NAME 		    DEPTNO DEPARTMENTNAME
---------- -------------------- ---------- --------------------
	 1 vybhav			 1
	11 vijay			 5
	 3 anirudh			 3
	 4 karthikeyan			 4
	 6 abc				 3
	 7 xyz				 2

6 rows selected.

select ssn from employee where deptno between 2 and 4
  2  ;

       SSN
----------
	 3
	 4
	 6
	 7

rename employee to employee100
  2  ;

Table renamed.

